{
  "kind": "story-allocation",
  "schema_version": 1,
  "example": true,
  "canonicalization": "bllt-canonical-json-v1",
  "story_id": "lion-and-mouse",
  "status": "allocated",
  "allocated_at": "2026-10-06T00:00:00Z",
  "allocated_by": "EXAMPLE-OWNER",
  "working_title": "The Lion and the Mouse",
  "production_slugs": [
    "lion_and_mouse_v5"
  ],
  "planned_languages": [
    "en",
    "es",
    "de"
  ]
}
